Title,Price,Image URL
Samsung Galaxy Z Flip 3 5G 128GB US Unlocked Phantom Black,$399.99 (4 Offers)–,https://c1.neweggimages.com/ProductImageCompressAll300/75-168-090-V08.jpg
Refurbished Motorola - Moto E (2020) - 32GB - GSM CDMA Unlocked - Midnight Blue - Excellent Mint Condition - 90 Day Warranty,$99.00 –,https://c1.neweggimages.com/ProductImageCompressAll300/AJT4S22052713AX36C2.jpg
Samsung Galaxy Z Flip 3 5G 256GB US Unlocked Phantom Black,,https://c1.neweggimages.com/ProductImageCompressAll300/75-168-091-V05.jpg
"Refurbished Samsung Galaxy S22 Ultra S908W 128GB Black (T-Mobile, Verizon)",$575.00 –,https://c1.neweggimages.com/ProductImageCompressAll300/APMJS22071916INCX74.jpg
Refurbished Samsung Galaxy S20 FE 5G G781U 128GB GSM/CDMA Fully Unlocked Android Smart Phone (USA Version) - Cloud Navy,$185.00 (3 Offers)–,https://c1.neweggimages.com/ProductImageCompressAll300/75-168-159-01.jpg
Samsung Galaxy S23 Ultra STANDARD EDITION Dual-SIM 256GB ROM + 8GB RAM (Only GSM | No CDMA) Factory Unlocked 5G Smartphone - International Version - Phantom Black,$874.99 (5 Offers)–,https://c1.neweggimages.com/ProductImageCompressAll300/AGRES230208140OQP36.jpg
"ASUS ROG Phone 6 Cell Phone, US Version, 16GB + 512GB, Storm White, Unlocked Phone, 6.78 FHD+ 165Hz, 6000mAh Battery, 50MP/13MP/5MP Triple Camera, 12MP Front, 5G LTE Dual SIM, AI2201-16G512G-WH",$599.99 (3 Offers)–,https://c1.neweggimages.com/ProductImageCompressAll300/APGSD2210181B369C03.jpg
"ASUS ROG Phone 6 Batman Edition Cell Phone, US Version, 12GB + 256GB, Unlocked Phone, 6.78 FHD+ 165Hz, 6000mAh Battery, 50MP/13MP/5MP Triple Camera, 12MP Front, 5G LTE Dual SIM, AI2201-12G256G-BM",$863.99 –,https://c1.neweggimages.com/ProductImageCompressAll300/mh2h_94b1de87-f4e1-4bb6-88eb-9c03d8e15c64.jpg
"GAMAKOO G14 4G Android Cell Phones Dual SIM 64GB+4GB 6.52"" HD+ Display | Octa-Core | 4000mAh Long Battery | Android 10.0 | Cheap Unlocked Smartphone Black",$89.99 –,https://c1.neweggimages.com/ProductImageCompressAll300/AY3NS23071108L8WY24.jpg
Samsung Galaxy A14 5G A146U 64GB GSM / CDMA Unlocked Android Smartphone (US Version) - Black,$231.76 (5 Offers)–,https://c1.neweggimages.com/ProductImageCompressAll300/AAM8D2303100ZE8WO75.jpg
"GAMAKOO K50 Unlocked Cell Phone 128GB+4GB Dual SIM 6.53"" HD+ Display | Android 10.0 | Octa-Core | 5380mAh Long Battery | US Version 4G Android Smartphone | Blue",$109.59 –,https://c1.neweggimages.com/ProductImageCompressAll300/AY3NS2304240I0GEB93.jpg
"Huness I14 Pro MAX Smartphone Unlocked Cell Phone,6+256GB Long Battery Life 6.82"" HD Screen Unlocked Phones, Android 13 with 128G Memory Card, Dual SIM/Fingerprint Lock/Face ID/GPS Blue",$158.99 –,https://c1.neweggimages.com/ProductImageCompressAll300/BRXYS2309231ANJJN6A.jpg
Xiaomi Redmi A2 Dual-SIM 64GB ROM + 4GB RAM (Only GSM | No CDMA) Factory Unlocked 4G/LTE Smartphone (Light Blue) - International Version,$79.99 (2 Offers)–,https://c1.neweggimages.com/ProductImageCompressAll300/AEJWS2309110WCM0V46.jpg
Refurbished Samsung - Galaxy A20 - 32 GB - Black - GSM CDMA Unlocked - Good Condition - 90 Day Warranty,$119.00 –,https://c1.neweggimages.com/ProductImageCompressAll300/AJT4S220413BgtBL.jpg
Xiaomi Redmi A2 Dual-SIM 64GB ROM + 4GB RAM (Only GSM | No CDMA) Factory Unlocked 4G/LTE Smartphone (Black) - International Version,$79.99 (2 Offers)–,https://c1.neweggimages.com/ProductImageCompressAll300/AEJWS2309110WEDNJDD.jpg
Samsung Galaxy A14 A145M Dual SIM GSM Unlocked Android Smartphone (Latin Variant/US Compatible LTE) - Silver,$159.98 (3 Offers)–,https://c1.neweggimages.com/ProductImageCompressAll300/AAM8D2304120Y8AY13C.jpg
Refurbished Samsung Galaxy A10e A102U (T-Mobile GSM Unlocked) 32GB Black,$85.00 –,https://c1.neweggimages.com/ProductImageCompressAll300/ARUJD22072214KQPL2A.jpg
"Samsung Galaxy S22 SM-S901UZKEXAA 5G Unlocked Cell Phone 6.1"" Phantom Black 256GB 8GB RAM",$851.99 (4 Offers)–,https://c1.neweggimages.com/ProductImageCompressAll300/75-168-106-V01.jpg
Google Pixel 7a Dual-SIM 128GB ROM + 8GB RAM (Only GSM | No CDMA) Factory Unlocked 5G Smartphone (Charcoal) - International Version,$399.99 (3 Offers)–,https://c1.neweggimages.com/ProductImageCompressAll300/AEJWS2305150S1DQ5F9.jpg
"GAMAKOO G14 Android Cell Phones Dual SIM 64GB+4GB 6.52"" HD+ Display | Octa-Core | 4000mAh Long Battery | Android 10.0 | Cheap 4G Unlocked Smartphone Blue",$159.00 –,https://c1.neweggimages.com/ProductImageCompressAll300/AY3NS23071107HCKX01.jpg
"Huness I14 Pro MAX Smartphone Unlocked Cell Phone,  6+256GB Long Battery Life 6.82"" HD Screen Unlocked Phones,Android 13 with 128G Memory Card, Dual SIM/Fingerprint Lock/Face ID/GPS Black",$158.99 (5 Offers)–,https://c1.neweggimages.com/ProductImageCompressAll300/BRXYS2309231A70QL84.jpg
"Nokia T20 10.4"" WIFI + LTE 4G 4/64GB ROM 8MP Unisoc T610 8200mAh Tablet By FedEx",$313.62 –,https://c1.neweggimages.com/ProductImageCompressAll300/BK15S2309250N0LEI03.jpg
Refurbished Samsung Galaxy A01 - 16GB - GSM Unlocked - Black - Great Condition - 90 Day warranty,$85.00 –,https://c1.neweggimages.com/ProductImageCompressAll300/AJT4S211203BLsYh.jpg
Samsung Galaxy A14 A145M Dual SIM GSM Unlocked Android Smartphone (Latin Variant/US Compatible LTE) - Black,$159.98 (2 Offers)–,https://c1.neweggimages.com/ProductImageCompressAll300/AAM8D2303100ZE8WO75.jpg
Samsung Galaxy A14 A145M Dual SIM GSM Unlocked Android Smartphone (Latin Variant/US Compatible LTE) - Light Green,$159.98 (3 Offers)–,https://c1.neweggimages.com/ProductImageCompressAll300/AAM8D2304120Y8AZ655.jpg
Samsung Galaxy Note 20 Ultra 5G Factory Unlocked Android Cell Phone | US Version | 128GB of Storage | Mobile Gaming Smartphone | Long-Lasting Battery | Mystic White,,https://c1.neweggimages.com/ProductImageCompressAll300/75-169-965-S01.jpg
"Refurbished Samsung Galaxy S22 Ultra S908W 128GB Black (T-Mobile, Verizon)",$575.00 –,https://c1.neweggimages.com/ProductImageCompressAll300/APMJS22071916INCX74.jpg
ASUS ZenFone 10 AI2302 (GSM ONLY NO CDMA) unlocked  | 8 GB/128 GB | MIDNIGHT BLACK,$688.99 (2 Offers)–,https://c1.neweggimages.com/ProductImageCompressAll300/AXJ8S2306270DWULF8D.jpg
Samsung Galaxy A53 5G A5360 (GSM ONLY NO CDMA) unlocked  | 8 GB/128 GB | Blue,$339.99 (3 Offers)–,https://c1.neweggimages.com/ProductImageCompressAll300/AXJ8S2204180LMB422C.jpg
Xiaomi 13 Ultra Dual-SIM 512GB ROM + 16GB RAM (Only GSM | No CDMA) Factory Unlocked 5G Smartphone (Black) - International Version,$894.99 (2 Offers)–,https://c1.neweggimages.com/ProductImageCompressAll300/AEJWS2306220WI0KVE5.jpg
"SAMSUNG Galaxy S23 Ultra Cell Phone, Factory Unlocked Android Smartphone, 512GB Storage, 200MP Camera, Night Mode, Long Battery Life, S Pen, US Version - Phantom Black","$1,249.00 (4 Offers)–",https://c1.neweggimages.com/ProductImageCompressAll300/AJ3AS230217175SLP4C.jpg
Refurbished Apple iPhone SE (2nd Gen) A2275 (Fully Unlocked) 64GB Black,$138.00 –,https://c1.neweggimages.com/ProductImageCompressAll300/ARUJD2207220B9VMR13.jpg
Refurbished Samsung Galaxy A01 - 16GB - GSM Unlocked - Black - Great Condition - 90 Day warranty,$85.00 –,https://c1.neweggimages.com/ProductImageCompressAll300/AJT4S211203BLsYh.jpg
ASUS ZenFone 8 Flip (ZS672KS) 8/128 (GSM ONLY NO CDMA) Unlocked | 8GB/128 GB | Galactic Black,$425.99 (4 Offers)–,https://c1.neweggimages.com/ProductImageCompressAll300/AXJ8S210519r5OLW.jpg
Google Pixel 6a Dual-SIM + eSIM 128GB ROM + 6GB RAM (GSM Only | No CDMA) Factory Unlocked 5G SmartPhone (Charcoal) - International Version,$619.00 –,https://c1.neweggimages.com/ProductImageCompressAll300/AEJWS2207220NAMH38C.jpg
"Samsung Galaxy S20 FE 5G | Factory Unlocked Android Cell Phone | 128 GB | US Version Smartphone | Pro-Grade Camera, 30X Space Zoom, Night Mode | Cloud Mint Green",,https://c1.neweggimages.com/ProductImageCompressAll300/75-169-997-V01.jpg
Samsung Galaxy A34 5G A346M 128GB Dual SIM GSM Unlocked Android Smartphone (Latin Variant/US Compatible LTE) - Awesome Lime,$241.34 (3 Offers)–,https://c1.neweggimages.com/ProductImageCompressAll300/AAM8D23050111VXRM1C.jpg
Samsung Galaxy A34 Dual-SIM 256GB ROM + 8GB RAM (Only GSM | No CDMA) Factory Unlocked 5G Smartphone (Awesome Graphite) - International Version,$274.99 –,https://c1.neweggimages.com/ProductImageCompressAll300/AKFJS230322yVUGi.jpg
Google Pixel 7a Dual-SIM 128GB ROM + 8GB RAM (Only GSM | No CDMA) Factory Unlocked 5G Smartphone (Snow) - International Version,$399.99 (2 Offers)–,https://c1.neweggimages.com/ProductImageCompressAll300/AEJWS2305150S1SF07F.jpg
"Samsung Galaxy S22 SM-S901UZKAXAA 5G Unlocked Cell Phone 6.1"" Phantom Black 128GB 8GB RAM",,https://c1.neweggimages.com/ProductImageCompressAll300/75-168-102-V01.jpg
"Google Pixel 7 Pro - 5G Android Phone - Unlocked Smartphone with Telephoto Lens, Wide Angle Lens, and 24-Hour Battery - 128GB - Obsidian",$830.99 (1 Offers)–,https://c1.neweggimages.com/ProductImageCompressAll300/A8X5S22112315FBUX30.jpg
Google Pixel 6 Pro Dual-SIM 128GB ROM + 12GB RAM (GSM | CDMA) Factory Unlocked 5G SmartPhone (Cloudy White) - International Version,$633.99 (6 Offers)–,https://c1.neweggimages.com/ProductImageCompressAll300/AEJWS211020oRyTc.jpg
"SAMSUNG Galaxy Z Flip 4 Cell Phone, Factory Unlocked Android Smartphone, 128GB, Flex Mode, Hands Free Camera, Compact, Foldable Design, Informative Cover Screen, US Version, Graphite",$779.00 (4 Offers)–,https://c1.neweggimages.com/ProductImageCompressAll300/A8X5S22110411BRJD4C.jpg
Samsung - Galaxy S23 256GB (Unlocked) - Phantom Black,,https://c1.neweggimages.com/ProductImageCompressAll300/BAU4S2302200Y68715C.jpg
"Samsung Galaxy S20 5G SM-G981UZAAXAA 5G Unlocked Cell Phone 6.2"" Cosmic Gray 128GB 12GB RAM",,https://c1.neweggimages.com/ProductImageCompressAll300/75-169-850-S01.jpg
"Samsung Galaxy Note 10+ Plus 256GB Factory Unlocked Aura Glow (Fully Unlocked, 6.8 Inch Display, 4G LTE, U.S. Version) SM-N975UZBAXAA",$479.97 (6 Offers)–,https://c1.neweggimages.com/ProductImageCompressAll300/AKTX_132181614425269068Ofrfk8k2Pw.jpg
Refurbished Samsung - Galaxy A20 - 32 GB - Black - GSM CDMA Unlocked - Good Condition - 90 Day Warranty,$119.00 –,https://c1.neweggimages.com/ProductImageCompressAll300/AJT4S220413BgtBL.jpg
Samsung Galaxy A54 5G A546E 128GB Dual SIM GSM Unlocked Android Smartphone (Latin Variant/US Compatible LTE) - Awesome Black,$299.99 (3 Offers)–,https://c1.neweggimages.com/ProductImageCompressAll300/AAM8D23033116AZSGFA.jpg
"Huness I14 Pro MAX Smartphone Unlocked Cell Phone, 6+256GB Long Battery Life 6.82"" HD Screen Unlocked Phones, Android 13 with 128G Memory Card, Dual SIM/Fingerprint Lock/Face ID/GPS Gold",$158.99 –,https://c1.neweggimages.com/ProductImageCompressAll300/BRXYS2309231ANYET77.jpg
"GAMAKOO G40 4G Unlocked Cell Phone Dual SIM | 6.52"" HD+ Display | 32GB+3GB | Octa-Core | Android 10.0 | 4000mAh Long Battery | US Version Android Cheap Smartphone | Blue",$85.59 –,https://c1.neweggimages.com/ProductImageCompressAll300/AY3NS2305170DAYF500.jpg
"GAMAKOO K50 Unlocked Cell Phone 128GB+4GB Dual SIM 6.53"" HD+ Display | Android 10.0 | Octa-Core | 5380mAh Long Battery | US Version 4G Android Smartphone | Grey",$109.59 (2 Offers)–,https://c1.neweggimages.com/ProductImageCompressAll300/AY3NS2305160FJ89135.jpg
Refurbished Samsung Galaxy S21 5G 128GB Fully Unlocked Phantom Gray Grade A,$249.00 (4 Offers)–,https://c1.neweggimages.com/ProductImageCompressAll300/A200S21110156E3E.jpg
"GAMAKOO G40 4G Unlocked Cell Phone Dual SIM | 6.52"" HD+ Display | 32GB+3GB | Octa-Core | Android 10.0 | 4000mAh Long Battery | US Version Android Cheap Smartphone | Black",$85.59 –,https://c1.neweggimages.com/ProductImageCompressAll300/AY3NS2305170DD8RX56.jpg
"Huness I14 Pro MAX Smartphone Unlocked Cell Phone, 6+256GB Long Battery Life 6.82"" HD Screen Unlocked Phones, Android 13 with 128G Memory Card, Dual SIM/Fingerprint Lock/Face ID/GPS White",$158.99 –,https://c1.neweggimages.com/ProductImageCompressAll300/BRXYS2309231AO7V52E.jpg
"Samsung Galaxy A14 (SM-A145M/DS) 6.6-inch FHD+ Display, 128GB + 4GB RAM, 50MP Camera, 4G LTE version, GSM Only, International Version - Black",$144.99 (4 Offers)–,https://c1.neweggimages.com/ProductImageCompressAll300/AGRES2303201C8BPA48.jpg
Used - Like New Samsung Galaxy A01 Lite SM-A015F (16GB) Factory GSM Unlocked International Version 4G LTE - Black,$79.00 –,https://c1.neweggimages.com/ProductImageCompressAll300/ANZJS2006045zVvV.jpg
Refurbished Samsung Galaxy A10e A102U (T-Mobile GSM Unlocked) 32GB Black,$85.00 (2 Offers)–,https://c1.neweggimages.com/ProductImageCompressAll300/ARUJD22072214KQPL2A.jpg
"Samsung Galaxy M12 (SM-M127F/DS) Dual SIM 64GB/ 4GB RAM, 6.5” GSM Unlocked International Version - No Warranty - Black",$199.99 –,https://c1.neweggimages.com/ProductImageCompressAll300/B4W3D22021416EGZNF8.jpg
"Samsung Galaxy A04e (SM-A042F/DS), 6.5"" HD+ Display, 32GB + 3GB RAM, 13MP Dual Camera, Factory Unlocked, International Version - Black",$89.99 (6 Offers)–,https://c1.neweggimages.com/ProductImageCompressAll300/AGRES2301131EYL29AF.jpg
Motorola - Moto G 5G 256GB (2022 Unlocked) - Moonlight Gray PATE0002US Smart Cell Phone Smartphone,$318.56 –,https://c1.neweggimages.com/ProductImageCompressAll300/A8X5S2208210XCV9HBC.jpg
"Huness I14 Pro MAX Smartphone Unlocked Cell Phone,  6+256GB Long Battery Life 6.82"" HD Screen Unlocked Phones,Android 13 with 128G Memory Card, Dual SIM/Fingerprint Lock/Face ID/GPS Black",$158.99 –,https://c1.neweggimages.com/ProductImageCompressAll300/BRXYS2309231A70QL84.jpg
"Huness I14 Pro MAX Smartphone Unlocked Cell Phone,  6+256GB Long Battery Life 6.82"" HD Screen Unlocked Phones, Android 13 with 128G Memory Card, Dual SIM/Fingerprint Lock/Face ID/GPS Purple",$158.99 –,https://c1.neweggimages.com/ProductImageCompressAll300/BRXYS2309231ANPA95B.jpg
Q5 Flip  4G phone 3GB Ram + 32GB Rom smartphone,$180.00 –,https://c1.neweggimages.com/ProductImageCompressAll300/BK5WS2309110KVO9D06.jpg
"Samsung Galaxy A24 A245M 128GB Dual SIM GSM Unlocked Android Smartphone (International, Latin America Variant/US Compatible LTE) - Black",,https://c1.neweggimages.com/ProductImageCompressAll300/AAM8D23051515EHO18D.jpg
"GAMAKOO K50 Unlocked Cell Phone 128GB+4GB Dual SIM 6.53"" HD+ Display | Android 10.0 | Octa-Core | 5380mAh Long Battery | US Version 4G Android Smartphone | Grey",$109.59 –,https://c1.neweggimages.com/ProductImageCompressAll300/AY3NS2305160FJ89135.jpg
"GAMAKOO K50 Android 4G Unlocked Smartphone | Dual SIM | 128GB+4GB | 6.53"" HD+ Display | Octa-Core | 5380mAh Long Battery | Android 10.0 | US Version Cheap Cell Phone | Green",$109.59 –,https://c1.neweggimages.com/ProductImageCompressAll300/AY3NS2305160FJWM035.jpg
NUU B10  |  Unlocked Smartphone | T-Mobile | Dual SIM | 4G LTE  | 48MP Triple-Camera | 6.55 HD+ Display | 64GB ROM + 4GB RAM | 4000mAh Battery | P60 Octa-Core| Android 11 | White Color,$99.90 (2 Offers)–,https://c1.neweggimages.com/ProductImageCompressAll300/B9WAS22042506EAE089.jpg
"GAMAKOO G14 4G Android Cell Phones Dual SIM 64GB+4GB 6.52"" HD+ Display | Octa-Core | 4000mAh Long Battery | Android 10.0 | Cheap Unlocked Smartphone Black",$89.99 (2 Offers)–,https://c1.neweggimages.com/ProductImageCompressAll300/AY3NS23071108L8WY24.jpg
Motorola Edge 256GB (Unlocked) Cell Phone Smartphone Smart - Nebula Blue PANX0000US,$321.99 (1 Offers)–,https://c1.neweggimages.com/ProductImageCompressAll300/A8X5S2208210X2W8XF4.jpg
Samsung Galaxy A04 A045M 64GB Dual SIM GSM Unlocked Android Smartphone (Latin America Variant) - Black,$165.99 –,https://c1.neweggimages.com/ProductImageCompressAll300/AAM8D2303010W9UU6A4.jpg
Refurbished Samsung Galaxy S9 G960U 64GB Unlocked GSM 4G LTE Phone w/ 12MP Camera - Lilac Purple,,https://c1.neweggimages.com/ProductImageCompressAll300/AAM8_1_20190117597926260.jpg
"Samsung Galaxy A03s (A037M) 64GB Dual SIM, GSM Unlocked, (CDMA Verizon/Sprint/Boost Not Supported) Smartphone Latin American Version No Warranty (Blue)",$159.99 –,https://c1.neweggimages.com/ProductImageCompressAll300/B4W3D2112181AL7JS7F.jpg
Refurbished Samsung galaxy S7 32gb Clean UNLOCKED,$120.00 –,https://c1.neweggimages.com/ProductImageCompressAll300/ADTWS22113019X2LZ63.jpg
"SAMSUNG Galaxy S22 Ultra Smartphone, Factory Unlocked Android Cell Phone, 128GB, 8K Camera & Video, Brightest Display, S Pen, Long Battery Life, Fast 4nm Processor, US Version, Phantom White",$798.95 (2 Offers)–,https://c1.neweggimages.com/ProductImageCompressAll300/A8X5S2205240V7N771F.jpg
Refurbished Samsung Galaxy A12 A125U 32GB GSM / CDMA Unlocked Android Smartphone (US Version) - Black,$99.00 (2 Offers)–,https://c1.neweggimages.com/ProductImageCompressAll300/AAM8D22050616769L7B.jpg
Refurbished Samsung Galaxy Note 9 128GB Lavender Purple (Unlocked) Grade A,$189.90 –,https://c1.neweggimages.com/ProductImageCompressAll300/AK2V_1_201908131573174654.jpg
"Refurbished Samsung Galaxy S10 G973U 4G LTE GSM/CDMA Unlocked Android Phone - (Certified Refurbished) 6.1"" Prism Blue 128GB 8GB RAM",$159.99 –,https://c1.neweggimages.com/ProductImageCompressAll300/AKSHS200320L3PJ9.jpg
"Samsung Galaxy A5 A510M 4G LTE Unlocked GSM Octa-Core Phone w/ 13MP Camera 5.2"" Gold 16GB 2GB RAM",$174.97 –,https://c1.neweggimages.com/ProductImageCompressAll300/75-169-267-S01.jpg
Refurbished Samsung Galaxy Note 10+ N975U 256GB GSM/CDMA Unlocked Android Phone (USA Version) - Aura Black,$449.99 –,https://c1.neweggimages.com/ProductImageCompressAll300/AAM8S210608mJy6X.jpg
"Google Pixel 7 Pro - 5G Android Phone - Unlocked Smartphone with Telephoto Lens, Wide Angle Lens, and 24-Hour Battery - 128GB - Hazel",$785.99 (2 Offers)–,https://c1.neweggimages.com/ProductImageCompressAll300/A8X5S2211180WXPVUCE.jpg
Refurbished Motorola Moto G Stylus  (2022) - 128 GB - GSM CDMA Unlocked - Twilight Blue - Great Condition - 90 Days Warranty,$109.00 –,https://c1.neweggimages.com/ProductImageCompressAll300/AJT4S2304300TC89C8D.jpg
BLU G50 Mega 2022 G0670WW 32GB Dual SIM GSM Unlocked Android Smartphone - Blue,$79.99 (2 Offers)–,https://c1.neweggimages.com/ProductImageCompressAll300/AAM8D22091312RZ1T72.jpg
NUU B20 5G | Unlocked Android Smartphone | 6.5 FHD+ Display with 90Hz Refresh Rate | 48MP Triple Camera System | 128GB + 8GB RAM | 5000mAh Battery with 18W Fast Charge | Android 12,,https://c1.neweggimages.com/ProductImageCompressAll300/B9WAS2302070D0IS8E3.jpg
NEW AT&T SAMSUNG GALAXY S8 SM-G950U 64GB MIDNIGHT BLACK LATEST SMARTPHONE,$324.97 –,https://c1.neweggimages.com/ProductImageCompressAll300/ACX4_131384022002644249httfExzPUj.jpg
Samsung Galaxy A34 5G A346M 128GB Dual SIM GSM Unlocked Android Smartphone (Latin Variant/US Compatible LTE) - Awesome Violet,,https://c1.neweggimages.com/ProductImageCompressAll300/AAM8D2306260TJNG06D.jpg
Refurbished Samsung Galaxy S22 Ultra 5G S908U 128GB GSM/CDMA Unlocked Android Smartphone (USA Version) - Phantom Black,$565.00 (2 Offers)–,https://c1.neweggimages.com/ProductImageCompressAll300/75-168-166-02.jpg
"Samsung Galaxy Note 8 64GB N950U GSM Unlocked 6.3"" Super AMOLED 6GB RAM Dual 12MP Smartphone - Orchid Gray",$379.97 –,https://c1.neweggimages.com/ProductImageCompressAll300/ABPX_131510642613048583Ofz0iPscxR.jpg
"Refurbished Samsung Galaxy Z Flip 3 5G Factory Unlocked Android Cell Phone US Version Smartphone Flex Mode Intuitive Camera Compact 128GB Storage US Warranty, Phantom Black (Renewed)",$309.00 –,https://c1.neweggimages.com/ProductImageCompressAll300/AGRES23011216H9TQF7.jpg
"Samsung Galaxy A24 A245M 128GB Dual SIM GSM Unlocked Android Smartphone (International, Latin America Variant/US Compatible LTE) - Lime Green",,https://c1.neweggimages.com/ProductImageCompressAll300/AAM8D23051516CQHC91.jpg
Refurbished Samsung Galaxy S10E G970U 128GB GSM/CDMA Unlocked Android Phone - Prism Blue,$202.99 –,https://c1.neweggimages.com/ProductImageCompressAll300/75-168-165-01.jpg
"Samsung Galaxy S10 4G LTE Unlocked Cell Phone 6.1"" Infinity Display Prism White 128GB 8GB RAM",$299.99 (3 Offers)–,https://c1.neweggimages.com/ProductImageCompressAll300/75-169-726-V08.jpg
Refurbished Apple iPhone 8 256GB Fully Unlocked Silver - Grade A,$169.99 (3 Offers)–,https://c1.neweggimages.com/ProductImageCompressAll300/BEDFS23083010103X23.jpg
"Refurbished SAMSUNG Galaxy S23 Ultra Cell Phone, Factory Unlocked Android Smartphone, 512GB Storage, 200MP Camera, Night Mode, Long Battery Life, S Pen, US Version, 2023 Phantom Black",$899.00 (2 Offers)–,https://c1.neweggimages.com/ProductImageCompressAll300/AH1US23112309LN1I7F.jpg
Refurbished Samsung Galaxy S21 Ultra 5G G998U 128GB GSM/CDMA Unlocked Android Smartphone (USA Version) - Phantom Silver,$415.00 (2 Offers)–,https://c1.neweggimages.com/ProductImageCompressAll300/75-168-154-02.jpg
"Samsung Galaxy Note 9 4G LTE Unlocked Cell Phone 6.4"" Midnight Black 128GB 6GB RAM",$285.00 (3 Offers)–,https://c1.neweggimages.com/ProductImageCompressAll300/75-169-776-V07.jpg
BLU G33 G0890UU 16GB GSM Unlocked Android Smartphone - Black,$69.98 –,https://c1.neweggimages.com/ProductImageCompressAll300/AAM8D23082311IZ0F7A.jpg
"GAMAKOO G40 4G Unlocked Cell Phone Dual SIM | 6.52"" HD+ Display | 32GB+3GB | Octa-Core | Android 10.0 | 4000mAh Long Battery | US Version Android Cheap Smartphone | Blue",$85.59 (2 Offers)–,https://c1.neweggimages.com/ProductImageCompressAll300/AY3NS2305170DAYF500.jpg
Refurbished Motorola - Moto E (2020) - 32GB - GSM CDMA Unlocked - Midnight Blue - Excellent Mint Condition - 90 Day Warranty,$99.00 –,https://c1.neweggimages.com/ProductImageCompressAll300/AJT4S22052713AX36C2.jpg
"Motorola Edge+ XT2061-3 4G LTE Unlocked Cell Phone 6.7"" Baltic Grey 256GB 12GB RAM","$2,876.99 –",https://c1.neweggimages.com/ProductImageCompressAll300/75-209-663-S01.jpg
"Unlocked Smartphone, Blackview A80, 2GB+16GB, Quad Rear Cameras, 4200mAh Battery, 6.2 inch Android 10.0 MTK6737V/W Quad Core up to 1.25GHz, Network: 4G, Dual SIM",$125.00 (2 Offers)–,https://c1.neweggimages.com/ProductImageCompressAll300/AP7MD21070477845.jpg
GAMAKOO G23 Android Smartphone Dual SIM 64GB+4GB 6.52 inch 4G Unlocked Cell Phone Octa-Core 4000mAh Long Battery Life Android 10.0 13MP+8MP Camera Mobile Phone | Black,$89.00 (4 Offers)–,https://c1.neweggimages.com/ProductImageCompressAll300/AY3NS2307120L2SXQDE.jpg
"GAMAKOO G14 Unlocked Cell Phones Dual SIM 64GB+4GB | 6.52"" HD+ Display | Octa-Core | Android 10.0 | 4000mAh Long Battery | 4G Android Cheap Smartphone| Blue",$169.59 (5 Offers)–,https://c1.neweggimages.com/ProductImageCompressAll300/AY3NS2306140H0T3D6F.jpg
"GAMAKOO G40 4G Unlocked Cell Phone 32GB+3GB Dual SIM 6.52"" HD+ Display Octa-Core Android 10.0 | 4000mAh Long Battery Cheap Android Smartphone US Version Black",$85.59 –,https://c1.neweggimages.com/ProductImageCompressAll300/AY3NS23071408L3V356.jpg
"GAMAKOO K50 Android Smartphone 128GB+4GB Dual SIM | 6.53"" HD+ Display | Octa-Core | Android 10.0 | 5380mAh Long Battery | 4G Unlocked Cell Phone US Version Green",$109.59 –,https://c1.neweggimages.com/ProductImageCompressAll300/AY3NS2307100LEXCI35.jpg
GAMAKOO G14 Pro Android Smartphone 128GB+4GB Dual SIM 6.7 inch | 4G Unlocked Cell Phone | Octa-Core | 5000mAh Long Battery Life | Android 10.0 | 16MP+8MP Camera Mobile Phone | Gold,$199.59 (4 Offers)–,https://c1.neweggimages.com/ProductImageCompressAll300/AY3NS2307120H6S7AD5.jpg
GAMAKOO G23 Android Smartphone Dual SIM 64GB+4GB | 6.52 inch 4G Unlocked Cell Phone | Expandable to 128GB | Octa-Core | 4000mAh Long Battery Life | Android 10.0 13MP+8MP Camera Mobile Phone | Pink,$89.99 –,https://c1.neweggimages.com/ProductImageCompressAll300/AY3NS2311220DFHVI33.jpg
"GAMAKOO G40 4G Unlocked Cell Phone Dual SIM 6.52"" HD+ Display Octa-Core Android 10.0 | 4000mAh Long Battery |32GB+3GB Expandable To 128G| Cheap Android Smartphone US Version Blue",$85.59 –,https://c1.neweggimages.com/ProductImageCompressAll300/AY3NS23112206Z70100.jpg
"GAMAKOO K50 Android Smartphone 128GB+4GB Dual SIM | 6.53"" HD+ Display | Octa-Core | Android 10.0 | 5380mAh Long Battery | Expandable to 256GB | 4G Unlocked Cell Phone US Version Blue",$109.59 –,https://c1.neweggimages.com/ProductImageCompressAll300/AY3NS23112207CN7G5A.jpg
GAMAKOO G23 Android Smartphone Dual SIM 64GB+4GB | 6.52 inch 4G Unlocked Cell Phone Octa-Core | Expandable to 128GB| 4000mAh Long Battery Life | Android 10.0 13MP+8MP Camera Mobile Phone | Green,$89.99 –,https://c1.neweggimages.com/ProductImageCompressAll300/AY3NS23112208X6454C.jpg
"GAMAKOO K50 Android Smartphone 128GB+4GB Dual SIM | 6.53"" HD+ Display | Octa-Core |  Expandable to 256GB | Android 10.0 | 5380mAh Long Battery | 4G Unlocked Cell Phone US Version Grey",$109.59 –,https://c1.neweggimages.com/ProductImageCompressAll300/AY3NS2311220DM5BIC3.jpg
GAMAKOO G23 Pro Android Smartphone Dual SIM 128GB+4GB 6.52 inch 4G Unlocked Cell Phone Octa-Core 4000mAh Long Battery Life Android 11.0 13MP+8MP Camera Mobile Phone | Black,$109.59 (3 Offers)–,https://c1.neweggimages.com/ProductImageCompressAll300/AY3NS2310310KQB5K28.jpg
"Energizer E242s, 2.4 inches Display, 4GB + 512MB RAM, International Version, GSM 4G/LTE Unlocked phone - Black",$59.99 –,https://c1.neweggimages.com/ProductImageCompressAll300/AGRES2308080TJ9ZM09.jpg
"ASUS ROG Phone 7 Unlocked Phone, US Version, 16GB + 512GB, Storm White, 6.78 FHD+ 165Hz, 6000mAh Battery, 50MP/13MP/5MP Triple Camera, 32MP Front, 5G LTE Dual SIM, AI2205-16G512G-WH",$959.99 (3 Offers)–,https://c1.neweggimages.com/ProductImageCompressAll300/A57XD2309161ARL249F.jpg
"Samsung Galaxy A11 SM-A115WZKAXAC 4G LTE Unlocked Cell Phone 6.4"" Black 32GB 2GB RAM",$169.97 –,https://c1.neweggimages.com/ProductImageCompressAll300/75-169-977-S01.jpg
"Samsung Galaxy Note 9 Unlocked Phone with 6.4"" Screen, 6GB/128GB, Ocean Blue",$309.99 (3 Offers)–,https://c1.neweggimages.com/ProductImageCompressAll300/A24G_1_201903251632358062.jpg
